<?xml version="1.0" encoding="UTF-8"?>
<!-- *************************************************************************** 
	Copyright (c) 2010 Qcadoo Limited Project: Qcadoo MES Version: 1.1.7 This 
	file is part of Qcadoo. Qcadoo is free software; you can redistribute it 
	and/or modify it under the terms of the GNU Affero General Public License 
	as published by the Free Software Foundation; either version 3 of the License, 
	or (at your option) any later version. This program is distributed in the 
	hope that it will be useful, but WITHOUT ANY WARRANTY; without even the implied 
	warranty of MERCHANTABILITY or FITNESS FOR A PARTICULAR PURPOSE. See the 
	GNU Affero General Public License for more details. You should have received 
	a copy of the GNU Affero General Public License along with this program; 
	if not, write to the Free Software Foundation, Inc., 51 Franklin St, Fifth 
	Floor, Boston, MA 02110-1301 USA *************************************************************************** -->
<model name="product" activable="true" auditable="true"
	xmlns:xsi="http://www.w3.org/2001/XMLSchema-instance" xmlns="http://schema.qcadoo.org/model"
	xsi:schemaLocation="http://schema.qcadoo.org/model http://schema.qcadoo.org/model.xsd">
	<fields>
		<string name="number" required="true" unique="true">
			<validatesLength max="255" />
		</string>
		<string name="name" required="true">
			<validatesLength max="1024" />
		</string>
		<enum name="globalTypeOfMaterial" values="01component,02intermediate,03finalProduct,04waste" />
		<string name="ean" unique="true" />
		<dictionary name="category" dictionary="categories" />
		<dictionary name="unit" dictionary="units" required="true" />
		<hasMany name="substitutes" model="substitute" joinField="product"
			cascade="delete" copyable="true" />
		<hasMany name="substituteComponents" model="substituteComponent"
			joinField="product" cascade="nullify" />
		<string name="externalNumber" />
		<string name="description">
			<validatesLength max="2048" />
		</string>
<!-- 		<hasMany name="conversionItems" joinField="conversion" model="conversionItem" /> -->
		<hasMany name="productConversion" joinField="product" model="conversionItem" />
				
		<!-- PRODUCTS FAMILY TREE -->
		<enum values="01particularProduct,02productsFamily" name="productFamilyElementType" />
		<belongsTo name="productFamilyParent" model="product" />
		<hasMany name="productFamilyChildren" joinField="parent" model="product"/>
		<tree name="productFamilyChildrenTree" joinField="productFamilyParent" model="product"
			cascade="nullify" persistent="false" />
		<priority name="productFamilyPriority" scope="parent" />
		
	</fields>
	<hooks>
		<onCopy class="com.qcadoo.mes.basic.ProductService" method="clearExternalIdOnCopy" />
		<onCreate class="com.qcadoo.mes.basic.ProductService" method="fillUnit" />
	</hooks>
	<identifier expression="#number + ' - ' + #name" />
</model>